{
  "seq": 2,
  "ts": "2026-01-01T00:05:00.000Z",
  "prevHash": "sha256:3354e113650d735af3579571f5cd58d61d90960b62c60f3d171c42d5bc5bced5",
  "type": "session.seal",
  "payload": {
    "sessionId": "8e92a687-dffa-4c36-b72a-5857df0f2586",
    "openEntryHash": "sha256:3354e113650d735af3579571f5cd58d61d90960b62c60f3d171c42d5bc5bced5",
    "outputCommitment": "sha256:1c1335c2079f088736a82addba96d30cadded757f06abe874cfa96c94353f8ea",
    "rawSha256": "sha256:329c7e0039ee9d051bfc12956536f92577ad71e107c710b2bd0c1462bfdcc122",
    "rawBlobRef": "blobs/sha256-329c7e0039ee9d051bfc12956536f92577ad71e107c710b2bd0c1462bfdcc122.bin",
    "leafBytes": 125,
    "nSamples": 180000,
    "ones": 89997,
    "witnessed": true,
    "witness": {
      "threshold": 1,
      "keys": ["ed25519:4444444444444444444444444444444444444444444444444444444444444444"],
      "open": [
        {
          "witnessPubKey": "ed25519:4444444444444444444444444444444444444444444444444444444444444444",
          "witnessRound": 29750000,
          "witnessChainHash": "52db9ba70e0cc0f6eaf7803dd07447a1f5477735fd3f661792ba94600c84e971",
          "witnessSig": "ed25519:55555555555555555555555555555555555555555555555555555555555555555555555555555555555555555555555555555555555555555555555555555555",
          "feedSeq": 0,
          "feedEntryHash": "sha256:ffff6666ffff6666ffff6666ffff6666ffff6666ffff6666ffff6666ffff6666"
        }
      ],
      "seal": [
        {
          "witnessPubKey": "ed25519:4444444444444444444444444444444444444444444444444444444444444444",
          "witnessRound": 29750200,
          "witnessChainHash": "52db9ba70e0cc0f6eaf7803dd07447a1f5477735fd3f661792ba94600c84e971",
          "witnessSig": "ed25519:66666666666666666666666666666666666666666666666666666666666666666666666666666666666666666666666666666666666666666666666666666666"
        }
      ]
    },
    "checkpoints": [
      {
        "trial": 5,
        "root": "sha256:9999aaaa9999aaaa9999aaaa9999aaaa9999aaaa9999aaaa9999aaaa9999aaaa",
        "witness": [
          {
            "witnessPubKey": "ed25519:4444444444444444444444444444444444444444444444444444444444444444",
            "witnessRound": 29750005,
            "witnessChainHash": "52db9ba70e0cc0f6eaf7803dd07447a1f5477735fd3f661792ba94600c84e971",
            "witnessSig": "ed25519:77777777777777777777777777777777777777777777777777777777777777777777777777777777777777777777777777777777777777777777777777777777"
          }
        ]
      }
    ]
  },
  "entryHash": "sha256:2222999922229999222299992222999922229999222299992222999922229999"
}
