{
  "seq": 8,
  "ts": "2026-01-02T12:05:00.000Z",
  "prevHash": "sha256:cccc3333cccc3333cccc3333cccc3333cccc3333cccc3333cccc3333cccc3333",
  "type": "session.seal",
  "payload": {
    "sessionId": "b1d4e8f2-0000-4000-8000-000000000001",
    "openEntryHash": "sha256:cccc3333cccc3333cccc3333cccc3333cccc3333cccc3333cccc3333cccc3333",
    "outputCommitment": "sha256:dddd4444dddd4444dddd4444dddd4444dddd4444dddd4444dddd4444dddd4444",
    "rawSha256": "sha256:eeee5555eeee5555eeee5555eeee5555eeee5555eeee5555eeee5555eeee5555",
    "rawBlobRef": "blobs/sha256-eeee5555eeee5555eeee5555eeee5555eeee5555eeee5555eeee5555eeee5555.bin",
    "trials": 20,
    "hits": 11,
    "optionsPerTrial": 2,
    "witnessed": true,
    "witness": {
      "threshold": 1,
      "keys": ["ed25519:4444444444444444444444444444444444444444444444444444444444444444"],
      "open": [
        {
          "witnessPubKey": "ed25519:4444444444444444444444444444444444444444444444444444444444444444",
          "witnessRound": 29750098,
          "witnessChainHash": "52db9ba70e0cc0f6eaf7803dd07447a1f5477735fd3f661792ba94600c84e971",
          "witnessSig": "ed25519:55555555555555555555555555555555555555555555555555555555555555555555555555555555555555555555555555555555555555555555555555555555",
          "feedSeq": 0,
          "feedEntryHash": "sha256:ffff6666ffff6666ffff6666ffff6666ffff6666ffff6666ffff6666ffff6666"
        }
      ],
      "seal": [
        {
          "witnessPubKey": "ed25519:4444444444444444444444444444444444444444444444444444444444444444",
          "witnessRound": 29750140,
          "witnessChainHash": "52db9ba70e0cc0f6eaf7803dd07447a1f5477735fd3f661792ba94600c84e971",
          "witnessSig": "ed25519:66666666666666666666666666666666666666666666666666666666666666666666666666666666666666666666666666666666666666666666666666666666",
          "feedSeq": 21,
          "feedEntryHash": "sha256:0000777700007777000077770000777700007777000077770000777700007777"
        }
      ]
    }
  },
  "entryHash": "sha256:1111888811118888111188881111888811118888111188881111888811118888"
}
